Bus Hound 6.00 capture on Windows Vista (x64). Complements of www.perisoft.net

  Device - Device ID (followed by the endpoint for USB devices)
            (16) HID Keyboard Device
  Phase  - Phase Type
            IN    Data in transfer           
  Data   - Hex dump of the data transferred
  Descr  - Description of the phase
  Cmd... - Position in the captured data


Device  Phase  Data                      Description       Cmd.Phase.Ofs(rep)
------  -----  ------------------------  ----------------  ------------------
  16    IN     01 00 1d 00  00 00 00 00  ........                 1.1.0(36)    
               00 00 00 00               ....                     1.1.8        
  16    IN     01 00 1e 00  00 00 00 00  ........                37.1.0        
               00 00 00 00               ....                    37.1.8        
  16    IN     01 00 1e 00  01 00 00 00  ........                38.1.0        
               00 00 00 00               ....                    38.1.8        
  16    IN     01 00 1d 00  01 00 00 00  ........                39.1.0        
               00 00 00 00               ....                    39.1.8        
  16    IN     01 00 2e 00  00 00 00 00  ........                40.1.0        
               00 00 00 00               ....                    40.1.8        
  16    IN     01 00 2e 00  01 00 00 00  ........                41.1.0        
               00 00 00 00               ....                    41.1.8        
  16    IN     01 00 14 00  00 00 00 00  ........                42.1.0        
               00 00 00 00               ....                    42.1.8        
  16    IN     01 00 14 00  01 00 00 00  ........                43.1.0        
               00 00 00 00               ....                    43.1.8        
  16    IN     01 00 13 00  00 00 00 00  ........                44.1.0        
               00 00 00 00               ....                    44.1.8        
  16    IN     01 00 13 00  01 00 00 00  ........                45.1.0        
               00 00 00 00               ....                    45.1.8        
  16    IN     01 00 26 00  00 00 00 00  ..&.....                46.1.0        
               00 00 00 00               ....                    46.1.8        
  16    IN     01 00 26 00  01 00 00 00  ..&.....                47.1.0        
               00 00 00 00               ....                    47.1.8        
  16    IN     01 00 2a 00  00 00 00 00  ..*.....                48.1.0        
               00 00 00 00               ....                    48.1.8        
  16    IN     01 00 2a 00  01 00 00 00  ..*.....                49.1.0        
               00 00 00 00               ....                    49.1.8        
  16    IN     01 00 2a 00  00 00 00 00  ..*.....                50.1.0        
               00 00 00 00               ....                    50.1.8        
  16    IN     01 00 0c 00  00 00 00 00  ........                51.1.0        
               00 00 00 00               ....                    51.1.8        
  16    IN     01 00 0c 00  01 00 00 00  ........                52.1.0        
               00 00 00 00               ....                    52.1.8        
  16    IN     01 00 2a 00  01 00 00 00  ..*.....                53.1.0        
               00 00 00 00               ....                    53.1.8        
  16    IN     01 00 0e 00  00 00 00 00  ........                54.1.0(2)     
               00 00 00 00               ....                    54.1.8        
  16    IN     01 00 0e 00  01 00 00 00  ........                55.1.0(2)     
               00 00 00 00               ....                    55.1.8        
  16    IN     01 00 2a 00  00 00 00 00  ..*.....                58.1.0        
               00 00 00 00               ....                    58.1.8        
  16    IN     01 00 2a 00  01 00 00 00  ..*.....                59.1.0        
               00 00 00 00               ....                    59.1.8        
  16    IN     01 00 2a 00  00 00 00 00  ..*.....                60.1.0        
               00 00 00 00               ....                    60.1.8        
  16    IN     01 00 0c 00  00 00 00 00  ........                61.1.0        
               00 00 00 00               ....                    61.1.8        
  16    IN     01 00 0c 00  01 00 00 00  ........                62.1.0        
               00 00 00 00               ....                    62.1.8        
  16    IN     01 00 1e 00  00 00 00 00  ........                63.1.0        
               00 00 00 00               ....                    63.1.8        
  16    IN     01 00 1e 00  01 00 00 00  ........                64.1.0        
               00 00 00 00               ....                    64.1.8        
  16    IN     01 00 2a 00  01 00 00 00  ..*.....                65.1.0        
               00 00 00 00               ....                    65.1.8        
  16    IN     01 00 0e 00  00 00 00 00  ........                66.1.0        
               00 00 00 00               ....                    66.1.8        
  16    IN     01 00 1e 00  00 00 00 00  ........                67.1.0        
               00 00 00 00               ....                    67.1.8        
  16    IN     01 00 0e 00  01 00 00 00  ........                68.1.0        
               00 00 00 00               ....                    68.1.8        
  16    IN     01 00 1e 00  01 00 00 00  ........                69.1.0        
               00 00 00 00               ....                    69.1.8        
  16    IN     01 00 34 00  00 00 00 00  ..4.....                70.1.0        
               00 00 00 00               ....                    70.1.8        
  16    IN     01 00 34 00  01 00 00 00  ..4.....                71.1.0        
               00 00 00 00               ....                    71.1.8        
  16    IN     01 00 0e 00  00 00 00 00  ........                72.1.0        
               00 00 00 00               ....                    72.1.8        
  16    IN     01 00 0e 00  01 00 00 00  ........                73.1.0        
               00 00 00 00               ....                    73.1.8        
  16    IN     01 00 1c 00  00 00 00 00  ........                74.1.0        
               00 00 00 00               ....                    74.1.8        
